{
  "$id": "https://wardline.dev/schemas/1.0/fingerprint.schema.json",
  "python_version": "3.12",
  "generated_at": "2026-04-11T18:47:58.610955+00:00",
  "coverage": {
    "annotated": 0,
    "total": 498,
    "ratio": 0.0,
    "tier1_annotated": 0,
    "tier1_total": 0,
    "tier1_unannotated": []
  },
  "fingerprints": []
}
